{
  "$schema": "agent_report.schema.json",
  "contract_name": "social_media_dashboard.agent_report",
  "schema_version": "1.0.0",
  "report_type": "daily_source_health",
  "run_id": "20261026T011011Z-e6dd1edc",
  "generated_at": "2026-10-25T21:10:39-04:00",
  "report_date": "2026-10-25",
  "timezone": "America/New_York",
  "freshness_policy": {
    "rule": "same_day_snapshot_and_successful_event",
    "healthy_lane_status": "ok",
    "carried_forward_is_current": false
  },
  "overall_status": "partial",
  "coverage": {
    "followers": {
      "current": 8,
      "required": 13,
      "missing": 5,
      "status": "partial"
    },
    "analytics": {
      "current": 4,
      "required": 8,
      "missing": 4,
      "status": "partial"
    },
    "combined": {
      "current": 12,
      "required": 21,
      "missing": 9,
      "status": "partial"
    }
  },
  "kpis": [
    {
      "metric_id": "total_followers",
      "value": 200453,
      "unit": "followers",
      "definition": "Sum of the latest available follower counts across required follower lanes; accounts are not deduplicated.",
      "completeness": {
        "status": "partial",
        "current": 8,
        "required": 13
      }
    },
    {
      "metric_id": "organic_previous_snapshot_gain",
      "value": 11194,
      "unit": "followers_change",
      "definition": "Follower change since each account's previous snapshot, excluding newly tracked audience.",
      "completeness": {
        "status": "complete",
        "current": 13,
        "required": 13
      }
    },
    {
      "metric_id": "gain_7d",
      "value": 602,
      "unit": "followers_change",
      "definition": "Organic follower change across accounts with usable seven-day history.",
      "completeness": {
        "status": "partial",
        "current": 5,
        "required": 13
      }
    },
    {
      "metric_id": "gain_30d",
      "value": 1461,
      "unit": "followers_change",
      "definition": "Organic follower change across accounts with usable thirty-day history.",
      "completeness": {
        "status": "partial",
        "current": 3,
        "required": 13
      }
    }
  ],
  "lanes": [
    {
      "lane_id": "analytics:ahrefs:lady-sublime-modelcentro",
      "account_id": "lady-sublime-modelcentro",
      "category": "analytics",
      "source_type": "ahrefs",
      "latest_event_id": 1036,
      "latest_snapshot_id": 22,
      "status": "not_attempted",
      "value_state": "carried_forward",
      "snapshot_age_days": 81,
      "latest_success_at": "2026-08-05T08:18:10-04:00",
      "latest_attempt_at": "2026-10-25T21:10:29-04:00",
      "collection_mode": "real_chrome"
    },
    {
      "lane_id": "analytics:ahrefs:lady-sublime-mymember",
      "account_id": "lady-sublime-mymember",
      "category": "analytics",
      "source_type": "ahrefs",
      "latest_event_id": 1037,
      "latest_snapshot_id": 6,
      "status": "pending_setup",
      "value_state": "carried_forward",
      "snapshot_age_days": 105,
      "latest_success_at": "2026-07-12T17:48:38-04:00",
      "latest_attempt_at": "2026-10-25T21:10:29-04:00",
      "collection_mode": "pending_setup"
    },
    {
      "lane_id": "analytics:beacons_social:lady-sublime-beacons",
      "account_id": "lady-sublime-beacons",
      "category": "analytics",
      "source_type": "beacons_social",
      "latest_event_id": 1034,
      "latest_snapshot_id": 20,
      "status": "not_attempted",
      "value_state": "carried_forward",
      "snapshot_age_days": 81,
      "latest_success_at": "2026-08-05T08:20:48-04:00",
      "latest_attempt_at": "2026-10-25T21:10:29-04:00",
      "collection_mode": "real_chrome"
    },
    {
      "lane_id": "analytics:ga4:lady-sublime-beacons",
      "account_id": "lady-sublime-beacons",
      "category": "analytics",
      "source_type": "ga4",
      "latest_event_id": 1020,
      "latest_snapshot_id": 134,
      "status": "ok",
      "value_state": "current",
      "snapshot_age_days": 0,
      "latest_success_at": "2026-10-25T21:10:18-04:00",
      "latest_attempt_at": "2026-10-25T21:10:18-04:00",
      "collection_mode": "automatic"
    },
    {
      "lane_id": "analytics:ga4:lady-sublime-clips4sale",
      "account_id": "lady-sublime-clips4sale",
      "category": "analytics",
      "source_type": "ga4",
      "latest_event_id": 1021,
      "latest_snapshot_id": 135,
      "status": "ok",
      "value_state": "current",
      "snapshot_age_days": 0,
      "latest_success_at": "2026-10-25T21:10:21-04:00",
      "latest_attempt_at": "2026-10-25T21:10:21-04:00",
      "collection_mode": "automatic"
    },
    {
      "lane_id": "analytics:ga4:lady-sublime-modelcentro",
      "account_id": "lady-sublime-modelcentro",
      "category": "analytics",
      "source_type": "ga4",
      "latest_event_id": 1022,
      "latest_snapshot_id": 136,
      "status": "ok",
      "value_state": "current",
      "snapshot_age_days": 0,
      "latest_success_at": "2026-10-25T21:10:24-04:00",
      "latest_attempt_at": "2026-10-25T21:10:24-04:00",
      "collection_mode": "automatic"
    },
    {
      "lane_id": "analytics:ga4:lady-sublime-mymember",
      "account_id": "lady-sublime-mymember",
      "category": "analytics",
      "source_type": "ga4",
      "latest_event_id": 1023,
      "latest_snapshot_id": 137,
      "status": "ok",
      "value_state": "current",
      "snapshot_age_days": 0,
      "latest_success_at": "2026-10-25T21:10:27-04:00",
      "latest_attempt_at": "2026-10-25T21:10:27-04:00",
      "collection_mode": "automatic"
    },
    {
      "lane_id": "analytics:link_analytics:lady-sublime-beacons",
      "account_id": "lady-sublime-beacons",
      "category": "analytics",
      "source_type": "link_analytics",
      "latest_event_id": 1033,
      "latest_snapshot_id": 25,
      "status": "not_attempted",
      "value_state": "carried_forward",
      "snapshot_age_days": 81,
      "latest_success_at": "2026-08-05T08:19:40-04:00",
      "latest_attempt_at": "2026-10-25T21:10:29-04:00",
      "collection_mode": "real_chrome"
    },
    {
      "lane_id": "follower:bluesky:lady-sublime-bluesky",
      "account_id": "lady-sublime-bluesky",
      "category": "follower",
      "source_type": "bluesky",
      "latest_event_id": 1029,
      "latest_snapshot_id": 606,
      "status": "ok",
      "value_state": "current",
      "snapshot_age_days": 0,
      "latest_success_at": "2026-10-25T21:10:37-04:00",
      "latest_attempt_at": "2026-10-25T21:10:37-04:00",
      "collection_mode": "automatic"
    },
    {
      "lane_id": "follower:clips4sale:lady-sublime-clips4sale",
      "account_id": "lady-sublime-clips4sale",
      "category": "follower",
      "source_type": "clips4sale",
      "latest_event_id": 1030,
      "latest_snapshot_id": 607,
      "status": "ok",
      "value_state": "current",
      "snapshot_age_days": 0,
      "latest_success_at": "2026-10-25T21:10:37-04:00",
      "latest_attempt_at": "2026-10-25T21:10:37-04:00",
      "collection_mode": "automatic"
    },
    {
      "lane_id": "follower:curvage:lady-sublime-curvage",
      "account_id": "lady-sublime-curvage",
      "category": "follower",
      "source_type": "curvage",
      "latest_event_id": 1032,
      "latest_snapshot_id": 600,
      "status": "error",
      "value_state": "carried_forward",
      "snapshot_age_days": 81,
      "latest_success_at": "2026-08-05T08:15:36-04:00",
      "latest_attempt_at": "2026-10-25T21:10:39-04:00",
      "collection_mode": "automatic_then_real_chrome"
    },
    {
      "lane_id": "follower:facebook:lady-sublime-facebook-page",
      "account_id": "lady-sublime-facebook-page",
      "category": "follower",
      "source_type": "facebook",
      "latest_event_id": 1025,
      "latest_snapshot_id": 603,
      "status": "ok",
      "value_state": "current",
      "snapshot_age_days": 0,
      "latest_success_at": "2026-10-25T21:10:32-04:00",
      "latest_attempt_at": "2026-10-25T21:10:32-04:00",
      "collection_mode": "automatic"
    },
    {
      "lane_id": "follower:feabie:lady-sublime-feabie",
      "account_id": "lady-sublime-feabie",
      "category": "follower",
      "source_type": "feabie",
      "latest_event_id": 1019,
      "latest_snapshot_id": 498,
      "status": "needs_login",
      "value_state": "carried_forward",
      "snapshot_age_days": 90,
      "latest_success_at": "2026-07-27T08:06:46-04:00",
      "latest_attempt_at": "2026-10-25T21:08:45-04:00",
      "collection_mode": "persistent_browser_then_real_chrome"
    },
    {
      "lane_id": "follower:instagram:girlfriend-instagram",
      "account_id": "girlfriend-instagram",
      "category": "follower",
      "source_type": "instagram",
      "latest_event_id": 1024,
      "latest_snapshot_id": 602,
      "status": "ok",
      "value_state": "current",
      "snapshot_age_days": 0,
      "latest_success_at": "2026-10-25T21:10:29-04:00",
      "latest_attempt_at": "2026-10-25T21:10:29-04:00",
      "collection_mode": "automatic"
    },
    {
      "lane_id": "follower:manyvids:lady-sublime-manyvids",
      "account_id": "lady-sublime-manyvids",
      "category": "follower",
      "source_type": "manyvids",
      "latest_event_id": 1031,
      "latest_snapshot_id": 608,
      "status": "ok",
      "value_state": "current",
      "snapshot_age_days": 0,
      "latest_success_at": "2026-10-25T21:10:38-04:00",
      "latest_attempt_at": "2026-10-25T21:10:38-04:00",
      "collection_mode": "automatic"
    },
    {
      "lane_id": "follower:onlyfans:lady-sublime-onlyfans",
      "account_id": "lady-sublime-onlyfans",
      "category": "follower",
      "source_type": "onlyfans",
      "latest_event_id": 1035,
      "latest_snapshot_id": 435,
      "status": "awaiting_manual",
      "value_state": "carried_forward",
      "snapshot_age_days": 97,
      "latest_success_at": "2026-07-20T13:54:06-04:00",
      "latest_attempt_at": "2026-10-25T21:10:29-04:00",
      "collection_mode": "manual"